{
  "schemaVersion": 1,
  "generatedAt": "2026-10-01T10:03:29.600Z",
  "sourceHashes": {
    "parametersSpec": "d20176fbca0a5c1ae66ccef41b879b9d7f6302ccc7fcf63bab9563973352223e",
    "bridgeParamMaps": "0132336941c52f56959c6a5304f22869b1f9a52717ed30a81db9467351849785",
    "byteMapData": "20e89936c53023766edfae356706dee3d5ac53239e7c6cbe8041f9dc23889b21",
    "parametersSpecCpp": "ac0680219056701a7f5106ea30b472dcc2eaeb0a15d2855d9f262f2497cd93c3"
  },
  "parameters": [
    {
      "id": "lfo1_rate",
      "byteOffset": 0,
      "category": "physical",
      "region": "LFO1",
      "codecType": "value",
      "byteMapType": "value",
      "enumMax": null,
      "enumLabels": null,
      "cc": 16,
      "legacyCC": null,
      "ccConflict": false,
      "name": "LFO 1 Rate",
      "desc": "0=slow…255=fast",
      "defaultValue": null,
      "aliases": [],
      "cppName": "Lfo1Rate",
      "index": 0
    },
    {
      "id": "lfo1_delay",
      "byteOffset": 1,
      "category": "physical",
      "region": "LFO1",
      "codecType": "value",
      "byteMapType": "value",
      "enumMax": null,
      "enumLabels": null,
      "cc": 17,
      "legacyCC": null,
      "ccConflict": false,
      "name": "LFO 1 Delay/Fade",
      "desc": "0=no delay…255=max delay",
      "defaultValue": null,
      "aliases": [],
      "cppName": "Lfo1Delay",
      "index": 1
    },
    {
      "id": "lfo1_shape",
      "byteOffset": 2,
      "category": "physical",
      "region": "LFO1",
      "codecType": "enum",
      "byteMapType": "enum",
      "enumMax": 6,
      "enumLabels": [
        "Sine",
        "Triangle",
        "Square",
        "Ramp Up",
        "Ramp Down",
        "S&H",
        "S&G"
      ],
      "cc": null,
      "legacyCC": null,
      "ccConflict": false,
      "name": "LFO 1 Shape",
      "desc": null,
      "defaultValue": null,
      "aliases": [],
      "cppName": "Lfo1Shape",
      "index": 2
    },
    {
      "id": "lfo1_key_sync",
      "byteOffset": 3,
      "category": "physical",
      "region": "LFO1",
      "codecType": "enum",
      "byteMapType": "toggle",
      "enumMax": 1,
      "enumLabels": null,
      "cc": null,
      "legacyCC": null,
      "ccConflict": false,
      "name": "LFO 1 Key Sync",
      "desc": "0=Off, 1=On",
      "defaultValue": null,
      "aliases": [],
      "cppName": "Lfo1KeySync",
      "index": 3
    },
    {
      "id": "lfo1_arp_sync",
      "byteOffset": 4,
      "category": "physical",
      "region": "LFO1",
      "codecType": "enum",
      "byteMapType": "toggle",
      "enumMax": 1,
      "enumLabels": null,
      "cc": null,
      "legacyCC": null,
      "ccConflict": false,
      "name": "LFO 1 Arp Sync",
      "desc": "0=Off, 1=On",
      "defaultValue": null,
      "aliases": [],
      "cppName": "Lfo1ArpSync",
      "index": 4
    },
    {
      "id": "lfo1_mono_mode",
      "byteOffset": 5,
      "category": "physical",
      "region": "LFO1",
      "codecType": "value",
      "byteMapType": "value",
      "enumMax": null,
      "enumLabels": null,
      "cc": null,
      "legacyCC": null,
      "ccConflict": false,
      "name": "LFO 1 Mono Mode",
      "desc": "0=Poly, 1=Mono, 2+=Spread",
      "defaultValue": null,
      "aliases": [],
      "cppName": "Lfo1MonoMode",
      "index": 5
    },
    {
      "id": "lfo1_slew",
      "byteOffset": 6,
      "category": "physical",
      "region": "LFO1",
      "codecType": "value",
      "byteMapType": "value",
      "enumMax": null,
      "enumLabels": null,
      "cc": null,
      "legacyCC": null,
      "ccConflict": false,
      "name": "LFO 1 Slew Rate",
      "desc": "0=no slew…255=max",
      "defaultValue": null,
      "aliases": [],
      "cppName": "Lfo1Slew",
      "index": 6
    },
    {
      "id": "lfo2_rate",
      "byteOffset": 7,
      "category": "physical",
      "region": "LFO2",
      "codecType": "value",
      "byteMapType": "value",
      "enumMax": null,
      "enumLabels": null,
      "cc": null,
      "legacyCC": null,
      "ccConflict": false,
      "name": "LFO 2 Rate",
      "desc": "0=slow…255=fast",
      "defaultValue": null,
      "aliases": [],
      "cppName": "Lfo2Rate",
      "index": 7
    },
    {
      "id": "lfo2_delay",
      "byteOffset": 8,
      "category": "physical",
      "region": "LFO2",
      "codecType": "value",
      "byteMapType": "value",
      "enumMax": null,
      "enumLabels": null,
      "cc": null,
      "legacyCC": null,
      "ccConflict": false,
      "name": "LFO 2 Delay/Fade",
      "desc": "0=no delay…255=max delay",
      "defaultValue": null,
      "aliases": [],
      "cppName": "Lfo2Delay",
      "index": 8
    },
    {
      "id": "lfo2_shape",
      "byteOffset": 9,
      "category": "physical",
      "region": "LFO2",
      "codecType": "enum",
      "byteMapType": "enum",
      "enumMax": 6,
      "enumLabels": [
        "Sine",
        "Triangle",
        "Square",
        "Ramp Up",
        "Ramp Down",
        "S&H",
        "S&G"
      ],
      "cc": null,
      "legacyCC": null,
      "ccConflict": false,
      "name": "LFO 2 Shape",
      "desc": null,
      "defaultValue": null,
      "aliases": [],
      "cppName": "Lfo2Shape",
      "index": 9
    },
    {
      "id": "lfo2_key_sync",
      "byteOffset": 10,
      "category": "physical",
      "region": "LFO2",
      "codecType": "enum",
      "byteMapType": "toggle",
      "enumMax": 1,
      "enumLabels": null,
      "cc": null,
      "legacyCC": null,
      "ccConflict": false,
      "name": "LFO 2 Key Sync",
      "desc": "0=Off, 1=On",
      "defaultValue": null,
      "aliases": [],
      "cppName": "Lfo2KeySync",
      "index": 10
    },
    {
      "id": "lfo2_arp_sync",
      "byteOffset": 11,
      "category": "physical",
      "region": "LFO2",
      "codecType": "enum",
      "byteMapType": "toggle",
      "enumMax": 1,
      "enumLabels": null,
      "cc": null,
      "legacyCC": null,
      "ccConflict": false,
      "name": "LFO 2 Arp Sync",
      "desc": "0=Off, 1=On",
      "defaultValue": null,
      "aliases": [],
      "cppName": "Lfo2ArpSync",
      "index": 11
    },
    {
      "id": "lfo2_mono_mode",
      "byteOffset": 12,
      "category": "physical",
      "region": "LFO2",
      "codecType": "value",
      "byteMapType": "value",
      "enumMax": null,
      "enumLabels": null,
      "cc": null,
      "legacyCC": null,
      "ccConflict": false,
      "name": "LFO 2 Mono Mode",
      "desc": "0=Poly, 1=Mono, 2+=Spread",
      "defaultValue": null,
      "aliases": [],
      "cppName": "Lfo2MonoMode",
      "index": 12
    },
    {
      "id": "lfo2_slew",
      "byteOffset": 13,
      "category": "physical",
      "region": "LFO2",
      "codecType": "value",
      "byteMapType": "value",
      "enumMax": null,
      "enumLabels": null,
      "cc": null,
      "legacyCC": null,
      "ccConflict": false,
      "name": "LFO 2 Slew Rate",
      "desc": "0=no slew…255=max",
      "defaultValue": null,
      "aliases": [],
      "cppName": "Lfo2Slew",
      "index": 13
    },
    {
      "id": "osc1_range",
      "byteOffset": 14,
      "category": "physical",
      "region": "OSC1",
      "codecType": "enum",
      "byteMapType": "enum",
      "enumMax": 2,
      "enumLabels": [
        "16'",
        "8'",
        "4'"
      ],
      "cc": null,
      "legacyCC": 18,
      "ccConflict": false,
      "name": "OSC1 Range",
      "desc": "Rango de octavas para OSC1",
      "defaultValue": 0.5,
      "aliases": [],
      "cppName": "Osc1Range",
      "index": 14
    },
    {
      "id": "osc2_range",
      "byteOffset": 15,
      "category": "physical",
      "region": "OSC2",
      "codecType": "enum",
      "byteMapType": "enum",
      "enumMax": 2,
      "enumLabels": [
        "16'",
        "8'",
        "4'"
      ],
      "cc": null,
      "legacyCC": null,
      "ccConflict": false,
      "name": "OSC 2 Range",
      "desc": null,
      "defaultValue": null,
      "aliases": [],
      "cppName": "Osc2Range",
      "index": 15
    },
    {
      "id": "osc1_pwm_source",
      "byteOffset": 16,
      "category": "physical",
      "region": "OSC1",
      "codecType": "enum",
      "byteMapType": "enum",
      "enumMax": 5,
      "enumLabels": [
        "Manual",
        "LFO 1",
        "LFO 2",
        "VCA Env",
        "VCF Env",
        "Mod Env"
      ],
      "cc": null,
      "legacyCC": null,
      "ccConflict": false,
      "name": "OSC 1 PWM Source",
      "desc": "Selects modulation source for PWM",
      "defaultValue": null,
      "aliases": [],
      "cppName": "Osc1PwmSource",
      "index": 16
    },
    {
      "id": "osc2_pm_source",
      "byteOffset": 32,
      "category": "physical",
      "region": "OSC2",
      "codecType": "enum",
      "byteMapType": "enum",
      "enumMax": 6,
      "enumLabels": [
        "LFO1",
        "LFO2",
        "VCA Env",
        "VCF Env",
        "Mod Env",
        "LFO1 Uni",
        "LFO2 Uni"
      ],
      "cc": null,
      "legacyCC": null,
      "ccConflict": false,
      "name": "OSC 2 Pitch Mod Select",
      "desc": null,
      "defaultValue": null,
      "aliases": [],
      "cppName": "Osc2PmSource",
      "index": 17
    },
    {
      "id": "osc2_tpm_source",
      "byteOffset": 17,
      "category": "physical",
      "region": "OSC2",
      "codecType": "enum",
      "byteMapType": "enum",
      "enumMax": 5,
      "enumLabels": [
        "Manual",
        "LFO 1",
        "LFO 2",
        "VCA Env",
        "VCF Env",
        "Mod Env"
      ],
      "cc": null,
      "legacyCC": null,
      "ccConflict": false,
      "name": "OSC 2 Tone Mod Source",
      "desc": "Also alias osc2_pm_source",
      "defaultValue": null,
      "aliases": [],
      "cppName": "Osc2TpmSource",
      "index": 18
    },
    {
      "id": "osc1_square_enable",
      "byteOffset": 18,
      "category": "physical",
      "region": "OSC1",
      "codecType": "enum",
      "byteMapType": "toggle",